{"$schema":"https://json-schema.org/draft/2020-12/schema","$id":"https://doxloop.dev/contracts/quality-report-v1.schema.json","title":"Doxloop quality report v1","type":"object","required":["schemaVersion","contractVersion","generatedAt","inputHash","project","generator","status","checks","counts","artifacts","options"],"properties":{"schemaVersion":{"const":1},"contractVersion":{"const":"1.0.0"},"generatedAt":{"type":"string","format":"date-time"},"inputHash":{"type":"string","pattern":"^[a-f0-9]{64}$"},"project":{"type":"string"},"generator":{"type":"string"},"status":{"enum":["pass","warning","fail"]},"checks":{"type":"array","items":{"type":"object","required":["code","category","status","message"],"properties":{"code":{"type":"string"},"category":{"enum":["validation","build","links","examples","schemas","accessibility","visual","lint","claims"]},"status":{"enum":["pass","warning","fail","skipped"]},"message":{"type":"string"},"file":{"type":"string"},"detail":{"type":"string"},"fixable":{"type":"boolean"}}}},"counts":{"type":"object","required":["passed","warnings","failed","skipped"],"properties":{"passed":{"type":"integer","minimum":0},"warnings":{"type":"integer","minimum":0},"failed":{"type":"integer","minimum":0},"skipped":{"type":"integer","minimum":0}}},"artifacts":{"type":"object"},"options":{"type":"object"}},"additionalProperties":false}
